[
  {
    "material_id": "concrete_raw_01",
    "name": "Concreto Aparente",
    "category": "concrete",
    "tags": ["exterior", "wall", "industrial", "modern"],
    "description": "Concreto aparente com textura natural, típico de projetos modernos",
    "pbr_properties": {
      "base_color": [0.55, 0.53, 0.50, 1.0],
      "metallic": 0.0,
      "roughness": 0.85,
      "emission": 0.0,
      "alpha": 1.0,
      "ior": 1.45,
      "transmission": 0.0
    },
    "sketchup_material_name": null
  },
  {
    "material_id": "concrete_polished_01",
    "name": "Concreto Polido",
    "category": "concrete",
    "tags": ["floor", "interior", "modern", "industrial"],
    "description": "Concreto polido com acabamento liso, comum em pisos internos",
    "pbr_properties": {
      "base_color": [0.60, 0.58, 0.55, 1.0],
      "metallic": 0.02,
      "roughness": 0.30,
      "emission": 0.0,
      "alpha": 1.0,
      "ior": 1.45,
      "transmission": 0.0
    },
    "sketchup_material_name": null
  },
  {
    "material_id": "wood_taco_01",
    "name": "Taco de Madeira",
    "category": "wood",
    "tags": ["floor", "interior", "warm", "classic"],
    "description": "Piso de taco de madeira com tom quente, acabamento acetinado",
    "pbr_properties": {
      "base_color": [0.45, 0.28, 0.14, 1.0],
      "metallic": 0.0,
      "roughness": 0.35,
      "emission": 0.0,
      "alpha": 1.0,
      "ior": 1.45,
      "transmission": 0.0
    },
    "sketchup_material_name": null
  },
  {
    "material_id": "wood_mdf_01",
    "name": "MDF Branco",
    "category": "wood",
    "tags": ["furniture", "interior", "cabinet", "modern"],
    "description": "MDF com acabamento branco fosco, comum em móveis planejados",
    "pbr_properties": {
      "base_color": [0.92, 0.91, 0.89, 1.0],
      "metallic": 0.0,
      "roughness": 0.45,
      "emission": 0.0,
      "alpha": 1.0,
      "ior": 1.45,
      "transmission": 0.0
    },
    "sketchup_material_name": null
  },
  {
    "material_id": "wood_plywood_01",
    "name": "Compensado Naval",
    "category": "wood",
    "tags": ["furniture", "interior", "modern", "natural"],
    "description": "Compensado naval com veios aparentes, acabamento natural",
    "pbr_properties": {
      "base_color": [0.62, 0.45, 0.28, 1.0],
      "metallic": 0.0,
      "roughness": 0.50,
      "emission": 0.0,
      "alpha": 1.0,
      "ior": 1.45,
      "transmission": 0.0
    },
    "sketchup_material_name": null
  },
  {
    "material_id": "glass_clear_01",
    "name": "Vidro Transparente",
    "category": "glass",
    "tags": ["window", "exterior", "interior", "transparent"],
    "description": "Vidro transparente para janelas e fachadas",
    "pbr_properties": {
      "base_color": [0.95, 0.97, 1.0, 0.1],
      "metallic": 0.0,
      "roughness": 0.02,
      "emission": 0.0,
      "alpha": 0.1,
      "ior": 1.52,
      "transmission": 0.95
    },
    "sketchup_material_name": null
  },
  {
    "material_id": "glass_tinted_01",
    "name": "Vidro Fumê",
    "category": "glass",
    "tags": ["window", "exterior", "facade", "tinted"],
    "description": "Vidro fumê para fachadas e divisórias",
    "pbr_properties": {
      "base_color": [0.15, 0.17, 0.20, 0.3],
      "metallic": 0.0,
      "roughness": 0.02,
      "emission": 0.0,
      "alpha": 0.3,
      "ior": 1.52,
      "transmission": 0.80
    },
    "sketchup_material_name": null
  },
  {
    "material_id": "metal_stainless_01",
    "name": "Aço Inox Escovado",
    "category": "metal",
    "tags": ["kitchen", "interior", "appliance", "modern"],
    "description": "Aço inoxidável com acabamento escovado",
    "pbr_properties": {
      "base_color": [0.75, 0.76, 0.78, 1.0],
      "metallic": 0.95,
      "roughness": 0.35,
      "emission": 0.0,
      "alpha": 1.0,
      "ior": 1.45,
      "transmission": 0.0
    },
    "sketchup_material_name": null
  },
  {
    "material_id": "metal_aluminum_01",
    "name": "Alumínio Anodizado",
    "category": "metal",
    "tags": ["exterior", "window_frame", "modern", "facade"],
    "description": "Alumínio com anodização natural, usado em esquadrias",
    "pbr_properties": {
      "base_color": [0.70, 0.72, 0.73, 1.0],
      "metallic": 0.90,
      "roughness": 0.25,
      "emission": 0.0,
      "alpha": 1.0,
      "ior": 1.45,
      "transmission": 0.0
    },
    "sketchup_material_name": null
  },
  {
    "material_id": "wall_plaster_01",
    "name": "Reboco Pintado Branco",
    "category": "wall",
    "tags": ["interior", "exterior", "wall", "classic"],
    "description": "Parede com reboco e pintura acrílica branca",
    "pbr_properties": {
      "base_color": [0.95, 0.94, 0.93, 1.0],
      "metallic": 0.0,
      "roughness": 0.70,
      "emission": 0.0,
      "alpha": 1.0,
      "ior": 1.45,
      "transmission": 0.0
    },
    "sketchup_material_name": null
  },
  {
    "material_id": "wall_brick_01",
    "name": "Tijolo à Vista",
    "category": "wall",
    "tags": ["interior", "exterior", "wall", "rustic", "industrial"],
    "description": "Parede de tijolos aparentes com rejunte",
    "pbr_properties": {
      "base_color": [0.55, 0.27, 0.15, 1.0],
      "metallic": 0.0,
      "roughness": 0.80,
      "emission": 0.0,
      "alpha": 1.0,
      "ior": 1.45,
      "transmission": 0.0
    },
    "sketchup_material_name": null
  },
  {
    "material_id": "floor_ceramic_01",
    "name": "Cerâmica Branca",
    "category": "floor",
    "tags": ["floor", "interior", "bathroom", "kitchen"],
    "description": "Piso cerâmico branco com acabamento acetinado",
    "pbr_properties": {
      "base_color": [0.92, 0.91, 0.90, 1.0],
      "metallic": 0.02,
      "roughness": 0.25,
      "emission": 0.0,
      "alpha": 1.0,
      "ior": 1.45,
      "transmission": 0.0
    },
    "sketchup_material_name": null
  },
  {
    "material_id": "floor_porcelain_01",
    "name": "Porcelanato Polido",
    "category": "floor",
    "tags": ["floor", "interior", "living_room", "luxury"],
    "description": "Porcelanato polido com brilho, acabamento premium",
    "pbr_properties": {
      "base_color": [0.85, 0.83, 0.80, 1.0],
      "metallic": 0.05,
      "roughness": 0.10,
      "emission": 0.0,
      "alpha": 1.0,
      "ior": 1.50,
      "transmission": 0.0
    },
    "sketchup_material_name": null
  },
  {
    "material_id": "stone_granite_01",
    "name": "Granito Preto",
    "category": "stone",
    "tags": ["countertop", "kitchen", "bathroom", "luxury"],
    "description": "Granito preto polido para bancadas",
    "pbr_properties": {
      "base_color": [0.08, 0.08, 0.08, 1.0],
      "metallic": 0.05,
      "roughness": 0.15,
      "emission": 0.0,
      "alpha": 1.0,
      "ior": 1.55,
      "transmission": 0.0
    },
    "sketchup_material_name": null
  },
  {
    "material_id": "stone_marble_01",
    "name": "Mármore Branco Carrara",
    "category": "stone",
    "tags": ["countertop", "floor", "bathroom", "luxury", "classic"],
    "description": "Mármore branco Carrara com veios cinza, acabamento polido",
    "pbr_properties": {
      "base_color": [0.93, 0.92, 0.91, 1.0],
      "metallic": 0.02,
      "roughness": 0.12,
      "emission": 0.0,
      "alpha": 1.0,
      "ior": 1.50,
      "transmission": 0.02
    },
    "sketchup_material_name": null
  }
]
